{
  "converged": true,
  "diagnostics": {
    "auxiliary_start": "1976-01-07T13:58:59.307000+00:00",
    "auxiliary_years": 2.0,
    "b_value": 0.9243976723401895,
    "benchmark_conventions": "EarthquakeNPP (Stockman, Lawson & Werner, TMLR 2026)",
    "branching_ratio": 0.9776472258061552,
    "branching_ratio_note": "expected offspring per event, k0 * beta / (beta - alpha), in closed form for this productivity law and mark distribution; comparable to the ETAS adapter's branching_ratio. At or above 1 the process is critical and its cascades do not terminate on their own",
    "config": {
      "background_sigma_km": 10.0,
      "epochs": 8000,
      "feature_clip": 3.0,
      "hidden": 16,
      "learning_rate": 0.05,
      "max_alpha_fraction": 0.95,
      "max_branching_ratio": 0.98,
      "n_space_basis": 5,
      "n_time_basis": 6,
      "omori_p": 1.15,
      "seed": 20220101,
      "space_scale_max_km": 50.0,
      "space_scale_min_km": 0.5,
      "spatial_s": 1.5,
      "time_scale_max_days": 100.0,
      "time_scale_min_days": 0.001,
      "weight_decay": 0.001
    },
    "config_hash": "1ef984d705c3dfbbb6e06f9adf89e709602be7045a0939385254a51195960e4f",
    "converged_reason": "no improvement over 0.01 nats for 50 epochs",
    "convergence_tol": 0.01,
    "delta_m": 0.1,
    "depth_pool": [
      11.0,
      8.0,
      11.0,
      30.0,
      10.0,
      27.2,
      15.0,
      8.0,
      13.3,
      26.6,
      25.9,
      23.5,
      11.0,
      10.0,
      33.0,
      33.0,
      8.0,
      7.0,
      8.0,
      6.0,
      12.2,
      10.0,
      10.0,
      10.0,
      15.2,
      6.0,
      10.0,
      10.0,
      42.9,
      11.0,
      11.0,
      41.2,
      31.9,
      9.0,
      8.0,
      15.0,
      41.2,
      15.0,
      11.0,
      10.0,
      9.0,
      14.8,
      32.3,
      10.0,
      9.0,
      10.0,
      16.8,
      8.0,
      15.0,
      10.0,
      33.9,
      30.5,
      10.0,
      10.0,
      22.7,
      14.0,
      15.0,
      10.0,
      15.0,
      10.0,
      11.0,
      12.0,
      4.9,
      9.0,
      9.0,
      9.0,
      10.0,
      8.2,
      9.0,
      9.0,
      10.0,
      9.0,
      9.0,
      9.0,
      9.0,
      9.0,
      9.0,
      8.0,
      40.5,
      8.0,
      23.4,
      10.0,
      7.0,
      8.0,
      10.0,
      10.0,
      9.0,
      10.0,
      15.0,
      11.0,
      7.0,
      7.0,
      10.0,
      10.0,
      10.0,
      7.0,
      15.0,
      10.0,
      21.8,
      10.0,
      7.0,
      27.5,
      10.0,
      8.0,
      15.0,
      15.0,
      10.0,
      20.0,
      8.0,
      12.0,
      8.0,
      18.6,
      10.0,
      7.0,
      10.0,
      10.0,
      10.0,
      7.0,
      7.0,
      11.0,
      10.0,
      22.3,
      11.0,
      19.1,
      10.0,
      11.0,
      6.0,
      13.9,
      7.0,
      15.0,
      24.4,
      9.0,
      10.0,
      15.7,
      9.0,
      15.0,
      24.9,
      7.0,
      9.0,
      13.2,
      8.0,
      29.5,
      9.0,
      12.0,
      8.0,
      12.5,
      24.6,
      11.7,
      29.5,
      12.9,
      17.3,
      22.0,
      4.8,
      10.0,
      25.0,
      7.0,
      16.1,
      10.0,
      7.0,
      20.5,
      11.0,
      11.0,
      26.3,
      14.9,
      9.0,
      9.0,
      6.0,
      6.0,
      14.2,
      5.3,
      8.0,
      8.9,
      8.5,
      11.0,
      15.8,
      7.0,
      5.7,
      10.0,
      10.0,
      12.6,
      10.0,
      15.3,
      5.9,
      18.0,
      12.6,
      12.0,
      12.0,
      8.0,
      8.0,
      2.0,
      10.7,
      3.4,
      7.0,
      7.0,
      5.1,
      10.0,
      1.5,
      6.3,
      10.4,
      10.0,
      15.0,
      5.2,
      2.6,
      5.8,
      2.8,
      10.0,
      24.8,
      38.1,
      38.6,
      5.0,
      4.1,
      7.7,
      4.8,
      9.0,
      6.5,
      1.5,
      0.5,
      5.0,
      9.7,
      10.0,
      10.7,
      6.3,
      10.0,
      7.5,
      10.9,
      3.3,
      6.2,
      1.2,
      6.5,
      12.8,
      9.0,
      10.1,
      6.8,
      10.0,
      9.7,
      18.0,
      10.9,
      11.5,
      10.4,
      11.0,
      4.8,
      1.0,
      8.2,
      8.6,
      4.4,
      8.1,
      10.0,
      3.2,
      5.8,
      10.5,
      8.6,
      7.3,
      8.4,
      5.0,
      1.6,
      8.9,
      1.8,
      3.0,
      5.0,
      6.7,
      10.0,
      4.4,
      13.9,
      2.8,
      17.0,
      11.5,
      12.0,
      4.5,
      16.2,
      1.1,
      4.2,
      17.6,
      10.7,
      10.0,
      8.4,
      4.4,
      6.6,
      2.2,
      8.3,
      5.0,
      9.8,
      10.0,
      13.3,
      9.7,
      9.5,
      13.8,
      9.9,
      17.1,
      0.5,
      8.7,
      0.2,
      3.8,
      8.2,
      8.4,
      6.0,
      6.1,
      1.7,
      9.7,
      1.7,
      1.7,
      15.1,
      10.2,
      9.0,
      12.1,
      9.6,
      10.9,
      5.0,
      19.1,
      11.6,
      8.2,
      8.5,
      6.4,
      13.5,
      9.7,
      11.2,
      9.9,
      17.6,
      17.6,
      15.0,
      10.0,
      2.7,
      10.0,
      1.7,
      10.0,
      3.5,
      2.8,
      9.0,
      10.0,
      5.0,
      2.2,
      12.1,
      3.4,
      3.9,
      10.0,
      11.1,
      7.4,
      7.2,
      10.1,
      12.6,
      4.2,
      3.5,
      10.0,
      5.7,
      10.0,
      1.0,
      11.0,
      12.3,
      2.2,
      3.3,
      5.3,
      4.7,
      6.0,
      12.1,
      10.0,
      0.3,
      5.7,
      10.5,
      3.3,
      1.1,
      8.0,
      7.2,
      1.3,
      9.6,
      1.5,
      2.9,
      3.9,
      1.3,
      1.7,
      10.0,
      1.1,
      3.1,
      3.4,
      10.0,
      9.8,
      3.8,
      1.3,
      6.9,
      1.2,
      6.7,
      10.0,
      6.6,
      1.0,
      3.4,
      6.3,
      9.6,
      5.3,
      10.0,
      5.8,
      5.6,
      6.4,
      1.6,
      4.4,
      10.0,
      5.3,
      11.9,
      4.6,
      3.5,
      9.6,
      0.4,
      5.6,
      12.0,
      4.5,
      6.4,
      8.3,
      3.9
    ],
    "epoch": "1976-01-07T13:58:59.307000+00:00",
    "epochs_run": 554,
    "feature_builder": {
      "clip": 3.0,
      "depth_fill": 9.7,
      "mc": 4.3,
      "standardiser": {
        "fitted_before": "2022-01-01T00:00:00+00:00",
        "mean": [
          0.4379012345679014,
          10.23728395061728
        ],
        "n_rows_fitted": 405,
        "names": [
          "mw_above_mc",
          "depth_km"
        ],
        "scale": [
          0.38033616076263504,
          7.024076234214958
        ]
      }
    },
    "final_nll": 5279.069437706531,
    "initial_nll": 10246.08186972456,
    "log_likelihood": {
      "compensator": 385.62326329682907,
      "mll": -0.2701474682454077,
      "n_events": 389,
      "nll": 13.301334263466789,
      "sll": -9.529751805095596,
      "tll": -3.771582458371191,
      "total": -5279.306393636045
    },
    "mc": 4.3,
    "mc_source": "region.mc (maximum_curvature)",
    "n_background_reference_points": 405,
    "n_scored_events": 389,
    "patience": 50,
    "productivity_by_magnitude": {
      "m4.3": 0.20359558314174594,
      "m4.8": 0.4728397960660352,
      "m5.3": 1.0981450053762325,
      "m5.8": 2.5503827361103735,
      "m6.3": 5.92312679000107,
      "m6.8": 13.756143528455121,
      "m7.3": 31.947903781986017,
      "m7.8": 74.19728893870167,
      "m8.3": 172.3192145381803
    },
    "projection": {
      "lat0": 37.75,
      "lon0": 38.5,
      "radius_km": 6378.1
    },
    "runtime_s": 34.6,
    "snapshot_digest": "5a549260d6da63d36183a8b420236d613d97bb771d34d3b00a1ab72552b07e8b",
    "timewindow_end": "2022-01-01T00:00:00+00:00",
    "timewindow_start": "1978-01-07T01:58:59.307000+00:00",
    "torch_version": "2.14.0",
    "training_max_origin_time": "2021-11-12T09:19:14.952000+00:00",
    "weights_digest": "6aa75f1f459d0ccc11286336d978e5074575b1a6f31bca133772b2b88bd1e68d"
  },
  "fit_cutoff": "2022-01-01T00:00:00Z",
  "fitted_at": "2026-09-03T22:01:08.636679Z",
  "log_likelihood": -5279.306393636045,
  "mc": 4.3,
  "model_id": "ntpp-neural-hawkes",
  "model_version": "ntpp-0.1.0+torch-2.14.0",
  "n_events": 405,
  "notes": "branching ratio 0.9776: close to the parameterisation's ceiling, so the fit is pressing against the subcriticality constraint and the productivity law is only weakly identified",
  "parameter_snapshot_hash": "8d8a21fbe1e3c038bb350ac085e14a478c26c27cb1777aa9a140a5bf0f7efa8f",
  "parameters": {
    "alpha": 1.6852420858958497,
    "alpha_raw": 1.610065371537028,
    "beta": 2.128504300328915,
    "branch_raw": 6.029553755230248,
    "branching_ratio": 0.9776472258061552,
    "k0": 0.20359558314174594,
    "log_beta": 0.7554195266405782,
    "log_mu": -4.328930202254601,
    "snapshot_0": 1515491936.0,
    "snapshot_1": 3604636627.0,
    "snapshot_2": 1636018356.0,
    "snapshot_3": 539192673.0,
    "snapshot_4": 1033354103.0,
    "snapshot_5": 490001328.0,
    "snapshot_6": 169522981.0,
    "snapshot_7": 1387298443.0
  },
  "region_id": "turkiye-eaf",
  "training_catalog_hash": "21ee1d78885f4e53ba2443e90c31d66fe6703a06e9d54abf1f2cd36ed858a7c6",
  "training_start": "1976-01-07T13:58:59.307000Z"
}
