{
  "converged": true,
  "diagnostics": {
    "area_km2": 148909.82605337075,
    "at_bound": [],
    "auxiliary_start": "2013-01-08T06:05:06.720000+00:00",
    "auxiliary_years": 2.0,
    "b_value": 1.0255402361529682,
    "beta_fixed": true,
    "branching_ratio": 0.8105355701795419,
    "branching_ratio_note": null,
    "converged_reason": "tolerance 0.001 reached",
    "coppersmith_multiplier": 100.0,
    "delta_m": 0.1,
    "em_tolerance": 0.001,
    "etas_commit": "097f08b69a4f06f9c38d14799dedfbd4543144e3",
    "iterations": 54,
    "log_likelihood_note": "the etas package does not expose the full point-process log-likelihood at convergence; log_likelihood is null",
    "max_iterations": 200,
    "max_seconds": 900.0,
    "mc": 4.3,
    "mc_source": "region.mc (maximum_curvature)",
    "n_hat_background": 57.00784973487197,
    "n_source_events": 446,
    "n_target_events": 435,
    "ranges": {
      "a": [
        0.01,
        20
      ],
      "gamma": [
        -1,
        5.0
      ],
      "log10_c": [
        -8,
        0
      ],
      "log10_d": [
        -4,
        3
      ],
      "log10_k0": [
        -20,
        10
      ],
      "log10_mu": [
        -10,
        0
      ],
      "log10_tau": [
        0.01,
        12.26
      ],
      "omega": [
        -0.99,
        1
      ],
      "rho": [
        0.01,
        5.0
      ]
    },
    "runtime_s": 106.67,
    "theta_0": {
      "a": 1.8,
      "gamma": 1.2,
      "log10_c": -2.5,
      "log10_d": -0.5,
      "log10_iota": null,
      "log10_k0": -2.5,
      "log10_mu": -6.0,
      "log10_tau": 3.5,
      "omega": -0.02,
      "rho": 0.6
    },
    "timewindow_end": "2023-02-13T01:17:34.342000+00:00",
    "timewindow_start": "2015-01-08T18:05:06.720000+00:00",
    "training_max_origin_time": "2023-02-12T22:52:59.819000+00:00"
  },
  "fit_cutoff": "2023-02-13T01:17:34.342000Z",
  "fitted_at": "2026-09-03T20:40:04.362354Z",
  "log_likelihood": null,
  "mc": 4.3,
  "model_id": "etas-mizrahi",
  "model_version": "etas-3.0.0+097f08b",
  "n_events": 446,
  "notes": null,
  "parameter_snapshot_hash": "fc80246e2214b4dcdd13ee8a603a3061c252b1297be970c3ce193b676c7e4a9b",
  "parameters": {
    "a": 3.081936720308204,
    "beta": 2.361393660031418,
    "gamma": 1.004590667087337,
    "log10_c": -1.6374393119321373,
    "log10_d": 1.9842246645673627,
    "log10_k0": 2.213811696263642,
    "log10_mu": -6.8878862735120245,
    "log10_tau": 0.9600165846525953,
    "omega": 0.16303197931348737,
    "rho": 1.849055549674368
  },
  "region_id": "aftershock-us6000jllz",
  "training_catalog_hash": "5321c95ef1eee978450691a2644fbec2f58c06ee607f3ca371d35e54a2577cc5",
  "training_start": "2013-01-08T06:05:06.720000Z"
}
